{
  "otdx": "0.1",
  "batch_id": "f586f743-38bf-7ae8-8e67-eac31f0e493b",
  "provider": "example",
  "profiles": [
    {
      "name": "signal",
      "critical": false
    }
  ],
  "created_at": "2026-07-18T03:00:05Z",
  "event_count": 1,
  "payload_encoding": "jsonl",
  "payload_sha256": "f7dde725f415f34fdbc2e3cce287de1b285f4f478f252d05de2b1572dd278ce4",
  "signature": {
    "alg": "Ed25519",
    "key_id": "otdx-test-1",
    "sig": "035xhKRZqxYJUppzx3bCmYmipx4nQksz6RS+giGH0OldF2UUL/uCQn/0XFzjlPcb7vj7cRzAlrtdKbPqjpanBQ=="
  }
}
