{
  "otdx": "0.1",
  "batch_id": "612a2a87-59f8-7ec3-8573-adb2a3aa9837",
  "provider": "example",
  "profiles": [],
  "created_at": "2026-07-18T03:00:05Z",
  "event_count": 1,
  "payload_encoding": "jsonl",
  "payload_sha256": "d6c78b62a6ec723b4012598f9e0b786e7237fe1ed137c02d8221198eb67b36ad",
  "signature": {
    "alg": "Ed25519",
    "key_id": "otdx-test-1",
    "sig": "y+iTzbvYsGje4DdCs6RBx4Dlv9Sn8ukGJwvScqrbBzP/G7ovChBCzftcWmLJUPj8wN4JFatwWBMwl+aCRj0vBA=="
  }
}
